url,article
https://propersky.com/areas-we-serve/willow-grove-pa-ehr-emr-support-consulting/,"From inception to go-live, Proper Sky has your EMR covered – you focus on patients
If your organization is evaluating an EMR or an EHR, you’re likely making the largest and most complicated technology commitment your organization will face. While EMR and EHR vendors promise everything, the delivery typically leaves much to be desired. Fortunately, fixing complicated, technical, and overwhelming issues is our specialty.
We provide comprehensive EHR and EMR support and consulting services in Willow Grove, PA. Our expert EHR and EMR consultants can help you select the best solution for your practice or if you already have an EHR/EMR package, we can help you get the most out of it.
By taking a simple approach that works with your enterprise’s needs, we review:
Helping you understand your technology investment
Before making a purchase, you have to consider several factors to ensure it’s worth your while. Though the questions you’ll ask yourself may seem simple, they quickly pile on. We’ll guide you every step of the way, before and after committing to an EHR.
Documenting essential information and training staff
EHR manuals often lack the practical information your staff needs in order to operate an EHR in a day-to-day environment. We specialize in training our clients’ teams to use a new EHR, so you can be confident your staff is using the technology correctly.
Determine your true data costs
When moving to a new EMR, you hope all of your data will be transferred. Sadly, this isn’t always the case. We can help you get the best amount of workable data possible from your legacy systems to your new systems, saving you time, money, and stress.
Turn data into insight
Analytics are crucial to business decisions, but EMR systems rarely come with the tools you need in order to understand your data. We’ll work with you to bring value to your data and give you the resources you need to make it meaningful.
By aligning the organizational goals of your enterprise, we can build a customized cybersecurity strategy that balances the latest threat intelligence and leading security practices with the factors that impact your at-risk information.
Security is the de facto way hackers break into your personal life. In this webinar, we review with real examples just what can happen if your email is compromised, what practical steps you can take to spot risks and how you can quickly improve your email security posture."
https://propersky.com/areas-we-serve/willow-grove-pa-it-strategy-planning/,"We believe in creating a tailored IT strategy completely aligned with your organization’s goals
Every business is unique; even in crowded local industries, internal processes for one company can be vastly different than those of another. You wouldn’t have the same sales strategy as your competitor — so why would you have a similar IT strategy? We help companies of all sizes in Willow Grove, PA with their IT planning and IT strategy.
Building an IT strategy that leverages your organization’s strengths and minimizes any weaknesses takes time and thorough consideration. We carefully factor those aspects into an IT strategy designed for your business.
Here’s what to expect when planning your IT strategy with Proper Sky:
Seek to Understand
Before planning a tailored IT strategy for your company, we gain a firm understanding of the internal workings of your organization. We develop strategies by identifying what makes your company unique, understanding how it functions, and clarifying your goals.
Meticulous strategic planning
We consider your company’s distinct functions, like team size and budget, so our recommendations don’t just work — but work for you. We lay comprehensive groundwork, ensuring your strategy maximizes your success..
Precision Execution
With a plan in place, it’s time to execute. We’ll work with you to implement your unique strategy, taking extra care to ensure it delivers the best results.
Measuring success in a practical way
Our partnership doesn’t end with implementation. We constantly measure our work’s impact, using data to determine the strategy’s success and identifying how we can improve it along the way.
All too often we see organizations view IT as a cost driver and not as an opportunity to increase their bottom line. Let us help you navigate the turbulent world of technology with a plan that fits around YOUR strategic objectives. You need a team with a demonstrated history of strategic success. You need Proper Sky.
Security is the de facto way hackers break into your personal life. In this webinar, we review with real examples just what can happen if your email is compromised, what practical steps you can take to spot risks and how you can quickly improve your email security posture."
https://propersky.com/areas-we-serve/willow-grove-pa-managed-it-support-services/,"Your team values efficiency, security, and innovation. By taking a proactive approach to information technology, you’ll know your team won’t be overburdened, and you’ll reduce unnecessary bottlenecks that prevent progress.
We provide professional managed IT support services in Willow Grove, PA:
Managed your business - We'll take care of the technical domain
Ready to stop juggling routine IT tasks within an already strained budget? We help organizations like yours handle daily technology duties and plan for extraordinary events without sapping resources from your mission.
Crisis Prevention Experts
When you need helpdesk support for daily operations, like password resets and hardware troubleshooting, managed IT services provide a scalable, flexible approach to talent to help your team members get to work quickly.
The Right Talent at the Right Time
When you need helpdesk support for daily operations, like password resets and hardware troubleshooting, managed IT services provide a scalable, flexible approach to talent to help your team members get to work quickly.
A Single Point of Contact
Because we manage all of your vendor relationships, issues with Internet slowness/outages, printers, phones, cell phones, websites are dealt with directly with the vendor by us. No more complicated vendor phone tag, one call; immediate results.
Find out how partnering with Proper Sky for Managed Services for your Willow Grove business can help you today!
Security is the de facto way hackers break into your personal life. In this webinar, we review with real examples just what can happen if your email is compromised, what practical steps you can take to spot risks and how you can quickly improve your email security posture."
https://propersky.com/areas-we-serve/willow-grove-pa-microsoft-office-365-support-consulting/,"Microsoft Office 365 is the trusted office suite you know and use every day at work. Office 365 is powered by the cloud, which enables you to access Microsoft’s collaboration and productivity tools from any device, at any location. We offer professional Microsoft Office 365 support and consulting services in Willow Grove, PA. Our expert Microsoft Office 365 consultants can help you get the most out of Microsoft Office 365 and ensure you are fully utilizing it to the fullest.
Cloud-Powered Benefits
The cloud technology of Office 365 makes it possible for organizations to work together through email, calendar, documents, sharing files, instant messaging, web conferencing and much more. You also receive peace of mind as risks born from viruses, malware, spam, and threats are eliminated.
99% uptime is guaranteed, with global data centers backing up and securing your data.
A full suite of Microsoft solutions.
Exchange Online
Enterprise-class email, contacts and calendar
SharePoint Online
File sharing, collaboration and intranet for both internal and external users
Skype for Business
Communications and online meetings
OneDrive for Business
Online cloud storage and sharing with unlimited data storage
Office Online
Microsoft Word, Excel, and PowerPoint available online leveraging an internet browser
Office ProPlus
Full, downloadable version of Microsoft Excel, PowerPoint, Publisher, and OneNote that you can install on up to 5 computers
Office 365 Support & Consulting
With years of industry-leading experience and expertise, Proper Sky frequently assists organizations in migration to Microsoft Office 365 services. We take care of the overall setup and post-implementation support to ensure your migration is supported each step of the way.
With our cloud services, your organization can lower overall costs and deliver the right set of tools to the right users, all with appropriate layers of security and compliance. Office 365 includes a financially backed service level agreement, allowing you to feel confident that you chose the best cloud solution.
The complete setup and configuration by our technical experts and 24/7 local support are just a few of the benefits Proper Sky offers. We are happy to assist your migration to ensure you get the most out of your Microsoft 365 service.
Security is the de facto way hackers break into your personal life. In this webinar, we review with real examples just what can happen if your email is compromised, what practical steps you can take to spot risks and how you can quickly improve your email security posture."
https://propersky.com/areas-we-serve/willow-grove-pa-network-security-consulting-auditing/,"In today’s always-on environment, a holistic approach to network security is far more effective than simply building digital walls. In this new, cloud-connected world, every enterprise needs to balance their business objectives with informational risk.
We offer professional network security consulting and auditing services in Willow Grove, PA to help ensure your network and valuable data is protected and secure. Our network security consultants will perform a security audit by analyzing your network and identifying areas of weakness that can be strengthened.
By taking a simple approach that works with your enterprise’s needs, we review:
External Threat Vectors
Today, the internet is a dangerous place, with hackers developing more sophisticated methods. As consumers add devices to our networks, they exponentially increase security risks. We provide solutions that keep you safer.
Rapid Technology Advances
The times, they are a-changing... How do you decide when legacy technology is holding your organization back? We'll help you make that decision — and manage changes for you.
Regulatory Compliance
Compliance might be required, but are you actually compliant? We'll work with you to ensure you're meeting compliance requirements in ways that also optimize your operations.
Threat Awareness
Does your team follow the latest security trends just for fun? Ours does. We'll bring our passion, concern, and awareness of current threats to the table in everything we do for you.
Best Practices. Delivered Optimally.
Our results are driven by metrics, and every day we look to improve outcomes through the expert implementation of best practices. We measure, we manage, and we apply this approach to improvement across all of our client services.
By aligning the organizational goals of your enterprise, we can build a customized cybersecurity strategy that balances the latest threat intelligence and leading security practices with the factors that impact your at-risk information.
Security is the de facto way hackers break into your personal life. In this webinar, we review with real examples just what can happen if your email is compromised, what practical steps you can take to spot risks and how you can quickly improve your email security posture."
https://propersky.com/areas-we-serve/willow-grove-pa-outsourced-it-support-services/,"Your team values efficiency, security, and innovation. By outsourcing your IT to us, you are taking a proactive approach to information technology, you’ll know your team won’t be overburdened, and you’ll reduce unnecessary bottlenecks that prevent progress.
We provide professional outsourced IT support services in Willow Grove, PA:
Run your business - We'll take care of the technical domain
Ready to stop juggling routine IT tasks within an already strained budget? We help organizations like yours handle daily technology duties and plan for extraordinary events without sapping resources from your mission.
Crisis Prevention Experts
When you need helpdesk support for daily operations, like password resets and hardware troubleshooting, managed IT services provide a scalable, flexible approach to talent to help your team members get to work quickly.
The Right Talent at the Right Time
When you need helpdesk support for daily operations, like password resets and hardware troubleshooting, outsourced IT services provide a scalable, flexible approach to talent to help your team members get to work quickly.
A Single Point of Contact
Because we manage all of your vendor relationships, issues with Internet slowness/outages, printers, phones, cell phones, websites are dealt with directly with the vendor by us. No more complicated vendor phone tag, one call; immediate results.
Find out how partnering with Proper Sky for Outsourced IT Services for your Willow Grove business can help you today!
Security is the de facto way hackers break into your personal life. In this webinar, we review with real examples just what can happen if your email is compromised, what practical steps you can take to spot risks and how you can quickly improve your email security posture."
https://propersky.com/areas-we-serve/willow-grove-pa-wireless-network-installation-support-consulting/,"A wireless network is an essential part of a business. The accessibility to information and mobility benefits it provides are crucial, keeping your business one step ahead in today’s competitive environment.
By utilizing a successful wireless network solution, a company can increase its revenue, improve employee productivity, enhance network security, and access business intelligence much easier.
Proper Sky provides wireless network installation, wireless network support and wireless network consulting in Willow Grove, PA. Our expert wireless network consultants can help you implement a powerful, robust wireless network into your business so you never have to deal with spotty coverage, slow speeds or outages again.
Whether it is an indoor or outdoor wireless network you require, we can deliver. Our service model follows a four-step approach and 100% coverage guaranteed system to ensure your wireless network installation expectations.
Survey
Our service starts with a site survey. We gain an overview of the wireless environment of your network, plan your objectives and outline the system you require.
Design
The wireless network we design factors in scalability for future growth including coverage, capacity, security, and redundancy.
Implementation
Our experienced wireless network installers will work with you to install your network with little or no disruption to your business and show you how to maintain it.
Post installation
Post the implementation phase we will perform a final wireless site survey. This ensures we have provided the coverage and capacity you require.
Why Proper Sky?
When it comes to wireless networks, we have what you need.
Whether you need a new wireless infrastructure or just needed a wireless installation service, we can provide it. We are also a partner and distributor to world-class wireless network device providers: Cisco Meraki, Ruckus, Aruba, and Ubiquiti.
You don’t have to build it all yourself. Do what you do best, and leave the rest to us. Our wireless installation service makes use of best practices- rest assured you receive the best output, in line with the standards you need.
Security is the de facto way hackers break into your personal life. In this webinar, we review with real examples just what can happen if your email is compromised, what practical steps you can take to spot risks and how you can quickly improve your email security posture."
https://propersky.com/benefits-of-using-a-local-it-services-provider-for-small-businesses/,"Why you should conduct a cybersecurity risk assessment for your business
[9 min read]
In the ever-evolving and increasingly popular fields of business and technology, upholding the best cybersecurity practices is paramount to ensure your customers, clients, or users aren’t exposed to the countless threats plaguing the internet. In addition to your customers’ virtual safety, businesses must remain vigilant against malicious hackers, bots, scripts, worms, and hundreds of simple yet devastating online attacks.
Cybersecurity risk assessments can help your businesses expose threats to your organization’s digital wellbeing and prioritize issues that may undermine your user’s privacy. The risk assessments are straightforward, lay the foundation for cybersecurity solutions, and may save your organization hundreds of thousands of dollars in damages in the future.
What is a cybersecurity risk assessment?
Typically, cybersecurity consultants schedule interviews with each of your company’s key members to analyze their policies, procedures, security measures, and daily practices. After compiling and analyzing the results, the consultant tailors a risk assessment to your business’s characteristics, factoring in team size, industry regulations and standards, projects, and technical literacy of your team.
Afterward, your IT staff works closely with the risk assessors to run through scenarios. They forecast vulnerabilities, the consequences they could have on your clients and organization, what practices the team should and shouldn’t be doing, as well as what tools your business can use to bolster its virtual security.
What is the purpose of IT & cybersecurity risk assessment?
Cybersecurity risk assessments help businesses emerge aware and ready to prevent cybersecurity risks. Your business’ IT staff should have the knowledge, resources, and ability to identify and prevent cybersecurity incidents, and having consultants, risk assessments, and periodic cybersecurity checks can save your business and customers.
Unfortunately, not all risk assessments are as simple as a checklist and an instruction manual. Especially in the cybersecurity realm, it can be difficult to quantify risks, and the threat issues pose to your business.
In most cases, cybersecurity consultants will combine their understanding of your business with their background in the modern security environment to help you create a plan of action against your most consequential security threats, IT vulnerabilities, and online practices.
Why do companies conduct cybersecurity risk assessments?
Usually, organizations conduct risk assessments before significant acquisitions, investments, changes with IT staff, when switching or adopting new technology, and periodically to keep up with the frighteningly rapid changes in the technological security space. Additionally, some industries so heavily rely on robust cybersecurity that organizations must conduct risk assessments to comply with laws and standards. Cybersecurity, healthcare, and finance are prime examples.
In most cases, IT management and support companies in the Philadelphia, Denver, and Pennsylvania areas will already incorporate risk management in their network security. Still, you can continually improve your company’s cybersecurity through managed IT services or risk assessments.
Benefits of Conducting a Cybersecurity Risk Assessment
Identify Cybersecurity & IT Vulnerabilities
Unlike speeding on the highway or walking alone in a bad neighborhood, the term “risk” has a different meaning in the cybersecurity world. Risk is the potential losses you face when a threat exploits a vulnerability.
Vulnerabilities like weak passwords introduce risks of unauthorized access and exposing confidential information. Companies can impose greater password requirements blacklist commonly used and easy-to-crack passwords to mitigate the risk of a password vulnerability.
While weak passwords are just one example of a vulnerability, everything from an email worm to a backdoor into your data centers are vulnerabilities that businesses must recognize. Each vulnerability poses a risk.
Whether your clients depend on you to ensure their data is safe or your employees entrust their company to protect their online presence, treat each vulnerability as if it were guaranteed to happen. Identify which mitigation strategies are best for the risk and your organization’s resources. Cybersecurity consultants and risks assessments help you do exactly that.
Professional cybersecurity reports and analyses
Cybersecurity risks can appear complicated, ambiguous, or too difficult to measure for new or small and medium businesses. Experts conduct cybersecurity risk assessments to create reports documenting your organization’s current security stature and relevant risks.
If you decide to conduct annual or regular cybersecurity risk assessments, your IT staff and cybersecurity team can quantitatively track your business’ progress as your team develops your security applications. Additionally, archiving regular risk assessments shows investors and clients that you actively invest in cybersecurity and care about everyone’s safety and information.
Available and tailored expertise
While cybersecurity assessment services provide you with valuable data, they represent a snippet of your company’s virtual security stature. For many businesses to reap the benefits of risk assessments, having involved and regular discussions with dedicated cybersecurity experts add exponentially more value to these assessments.
Cybersecurity risk assessments are results, not solutions. They provide businesses with a foundation to solve their vulnerabilities and account for risk. It’s up to you to create cybersecurity solutions; the risk assessment is merely a tool to achieve that.
Even if your IT team consists of a cybersecurity professional, external consultants and other experts can provide your company with more insight, potentially reveal vulnerabilities that your internal team overlooked, and add a broad range of expertise and knowledge to the minds of your staff.
Most of the time, when organizations perform cybersecurity risk assessments, experts identify gaps in a business’s security practices undocumented risks and introduce new threats that weren’t initially in the company’s crosshairs. Identifying hidden internal and external cybersecurity threats could be the difference between saving your company’s data and trying to purchase it from ransomware.
Adaptable risk registers
Risk assessments reveal the most critical and pressing cybersecurity risks your business faces. In most cases, experts will also prioritize those risks based on your company’s resources, core values, and IT team’s capability so you can take immediate action.
The cybersecurity consultants will do their best to provide you with the insight and tools to create an effective risk-mitigation plan. Businesses should use the risk mitigation plan and the consultant’s problem-solving experience to identify how to solve vulnerabilities and address risks.
Understand how equipped your business is to address risks
Cybercriminals and hackers are not the only threats in cybersecurity. Corporate leaders must acknowledge and address non-malicious threats alongside harmful attacks. For example, a business not continually backing up critical data can cripple the entire organization and expose users and customers.
In the event of a power surge, fire, or natural wear and tear of the hardware, companies can face tremendous consequences if they do not mitigate the risk. This principle applies to every threat, scenario, and point of failure.
Risk assessment specialists almost always have or can help you acquire the resources to find vulnerabilities. When searching for cybersecurity consultants, managed cybersecurity services, or performing a risk assessment, consider these factors:
- Technical vulnerabilities
- Governance inconsistencies
- Compliance gaps
- Vendor risks
- Human error
- Risk prioritization
- Risk assessment frequency
- Tools and techniques used
- Business aspects covered in the risk assessment
While not all IT management companies in Philadelphia will specialize in network and cybersecurity, most can provide you with information, system, or cyber risk analyses for businesses to consider their services.
No Comments"
