url,article
https://propersky.com/areas-we-serve/fort-washington-pa-ehr-emr-support-consulting/,"From inception to go-live, Proper Sky has your EMR covered – you focus on patients
If your organization is evaluating an EMR or an EHR, you’re likely making the largest and most complicated technology commitment your organization will face. While EMR and EHR vendors promise everything, the delivery typically leaves much to be desired. Fortunately, fixing complicated, technical, and overwhelming issues is our specialty.
We provide comprehensive EHR and EMR support and consulting services in Fort Washington, PA. Our expert EHR and EMR consultants can help you select the best solution for your practice or if you already have an EHR/EMR package, we can help you get the most out of it.
By taking a simple approach that works with your enterprise’s needs, we review:
Helping you understand your technology investment
Before making a purchase, you have to consider several factors to ensure it’s worth your while. Though the questions you’ll ask yourself may seem simple, they quickly pile on. We’ll guide you every step of the way, before and after committing to an EHR.
Documenting essential information and training staff
EHR manuals often lack the practical information your staff needs in order to operate an EHR in a day-to-day environment. We specialize in training our clients’ teams to use a new EHR, so you can be confident your staff is using the technology correctly.
Determine your true data costs
When moving to a new EMR, you hope all of your data will be transferred. Sadly, this isn’t always the case. We can help you get the best amount of workable data possible from your legacy systems to your new systems, saving you time, money, and stress.
Turn data into insight
Analytics are crucial to business decisions, but EMR systems rarely come with the tools you need in order to understand your data. We’ll work with you to bring value to your data and give you the resources you need to make it meaningful.
By aligning the organizational goals of your enterprise, we can build a customized cybersecurity strategy that balances the latest threat intelligence and leading security practices with the factors that impact your at-risk information.
Security is the de facto way hackers break into your personal life. In this webinar, we review with real examples just what can happen if your email is compromised, what practical steps you can take to spot risks and how you can quickly improve your email security posture."
https://propersky.com/areas-we-serve/fort-washington-pa-it-strategy-planning/,"We believe in creating a tailored IT strategy completely aligned with your organization’s goals
Every business is unique; even in crowded local industries, internal processes for one company can be vastly different than those of another. You wouldn’t have the same sales strategy as your competitor — so why would you have a similar IT strategy? We help companies of all sizes in Fort Washington, PA with their IT planning and IT strategy.
Building an IT strategy that leverages your organization’s strengths and minimizes any weaknesses takes time and thorough consideration. We carefully factor those aspects into an IT strategy designed for your business.
Here’s what to expect when planning your IT strategy with Proper Sky:
Seek to Understand
Before planning a tailored IT strategy for your company, we gain a firm understanding of the internal workings of your organization. We develop strategies by identifying what makes your company unique, understanding how it functions, and clarifying your goals.
Meticulous strategic planning
We consider your company’s distinct functions, like team size and budget, so our recommendations don’t just work — but work for you. We lay comprehensive groundwork, ensuring your strategy maximizes your success..
Precision Execution
With a plan in place, it’s time to execute. We’ll work with you to implement your unique strategy, taking extra care to ensure it delivers the best results.
Measuring success in a practical way
Our partnership doesn’t end with implementation. We constantly measure our work’s impact, using data to determine the strategy’s success and identifying how we can improve it along the way.
All too often we see organizations view IT as a cost driver and not as an opportunity to increase their bottom line. Let us help you navigate the turbulent world of technology with a plan that fits around YOUR strategic objectives. You need a team with a demonstrated history of strategic success. You need Proper Sky.
Security is the de facto way hackers break into your personal life. In this webinar, we review with real examples just what can happen if your email is compromised, what practical steps you can take to spot risks and how you can quickly improve your email security posture."
https://propersky.com/areas-we-serve/fort-washington-pa-managed-it-support-services/,"Your team values efficiency, security, and innovation. By taking a proactive approach to information technology, you’ll know your team won’t be overburdened, and you’ll reduce unnecessary bottlenecks that prevent progress.
We provide professional managed IT support services in Fort Washington, PA:
Managed your business - We'll take care of the technical domain
Ready to stop juggling routine IT tasks within an already strained budget? We help organizations like yours handle daily technology duties and plan for extraordinary events without sapping resources from your mission.
Crisis Prevention Experts
When you need helpdesk support for daily operations, like password resets and hardware troubleshooting, managed IT services provide a scalable, flexible approach to talent to help your team members get to work quickly.
The Right Talent at the Right Time
When you need helpdesk support for daily operations, like password resets and hardware troubleshooting, managed IT services provide a scalable, flexible approach to talent to help your team members get to work quickly.
A Single Point of Contact
Because we manage all of your vendor relationships, issues with Internet slowness/outages, printers, phones, cell phones, websites are dealt with directly with the vendor by us. No more complicated vendor phone tag, one call; immediate results.
Find out how partnering with Proper Sky for Managed Services for your Fort Washington business can help you today!
Security is the de facto way hackers break into your personal life. In this webinar, we review with real examples just what can happen if your email is compromised, what practical steps you can take to spot risks and how you can quickly improve your email security posture."
https://propersky.com/areas-we-serve/fort-washington-pa-microsoft-office-365-support-consulting/,"Microsoft Office 365 is the trusted office suite you know and use every day at work. Office 365 is powered by the cloud, which enables you to access Microsoft’s collaboration and productivity tools from any device, at any location. We offer professional Microsoft Office 365 support and consulting services in Fort Washington, PA. Our expert Microsoft Office 365 consultants can help you get the most out of Microsoft Office 365 and ensure you are fully utilizing it to the fullest.
Cloud-Powered Benefits
The cloud technology of Office 365 makes it possible for organizations to work together through email, calendar, documents, sharing files, instant messaging, web conferencing and much more. You also receive peace of mind as risks born from viruses, malware, spam, and threats are eliminated.
99% uptime is guaranteed, with global data centers backing up and securing your data.
A full suite of Microsoft solutions.
Exchange Online
Enterprise-class email, contacts and calendar
SharePoint Online
File sharing, collaboration and intranet for both internal and external users
Skype for Business
Communications and online meetings
OneDrive for Business
Online cloud storage and sharing with unlimited data storage
Office Online
Microsoft Word, Excel, and PowerPoint available online leveraging an internet browser
Office ProPlus
Full, downloadable version of Microsoft Excel, PowerPoint, Publisher, and OneNote that you can install on up to 5 computers
Office 365 Support & Consulting
With years of industry-leading experience and expertise, Proper Sky frequently assists organizations in migration to Microsoft Office 365 services. We take care of the overall setup and post-implementation support to ensure your migration is supported each step of the way.
With our cloud services, your organization can lower overall costs and deliver the right set of tools to the right users, all with appropriate layers of security and compliance. Office 365 includes a financially backed service level agreement, allowing you to feel confident that you chose the best cloud solution.
The complete setup and configuration by our technical experts and 24/7 local support are just a few of the benefits Proper Sky offers. We are happy to assist your migration to ensure you get the most out of your Microsoft 365 service.
Security is the de facto way hackers break into your personal life. In this webinar, we review with real examples just what can happen if your email is compromised, what practical steps you can take to spot risks and how you can quickly improve your email security posture."
https://propersky.com/areas-we-serve/fort-washington-pa-network-security-consulting-auditing/,"In today’s always-on environment, a holistic approach to network security is far more effective than simply building digital walls. In this new, cloud-connected world, every enterprise needs to balance their business objectives with informational risk.
We offer professional network security consulting and auditing services in Fort Washington, PA to help ensure your network and valuable data is protected and secure. Our network security consultants will perform a security audit by analyzing your network and identifying areas of weakness that can be strengthened.
By taking a simple approach that works with your enterprise’s needs, we review:
External Threat Vectors
Today, the internet is a dangerous place, with hackers developing more sophisticated methods. As consumers add devices to our networks, they exponentially increase security risks. We provide solutions that keep you safer.
Rapid Technology Advances
The times, they are a-changing... How do you decide when legacy technology is holding your organization back? We'll help you make that decision — and manage changes for you.
Regulatory Compliance
Compliance might be required, but are you actually compliant? We'll work with you to ensure you're meeting compliance requirements in ways that also optimize your operations.
Threat Awareness
Does your team follow the latest security trends just for fun? Ours does. We'll bring our passion, concern, and awareness of current threats to the table in everything we do for you.
Best Practices. Delivered Optimally.
Our results are driven by metrics, and every day we look to improve outcomes through the expert implementation of best practices. We measure, we manage, and we apply this approach to improvement across all of our client services.
By aligning the organizational goals of your enterprise, we can build a customized cybersecurity strategy that balances the latest threat intelligence and leading security practices with the factors that impact your at-risk information.
Security is the de facto way hackers break into your personal life. In this webinar, we review with real examples just what can happen if your email is compromised, what practical steps you can take to spot risks and how you can quickly improve your email security posture."
https://propersky.com/areas-we-serve/fort-washington-pa-outsourced-it-support-services/,"Outsourced IT Support Services | Fort Washington, PA
You run your business, we’ll run the IT.
Your team values efficiency, security, and innovation. By outsourcing your IT to us, you are taking a proactive approach to information technology, you’ll know your team won’t be overburdened, and you’ll reduce unnecessary bottlenecks that prevent progress.
We provide professional outsourced IT support services in Fort Washington, PA:
Run your business - We'll take care of the technical domain
Ready to stop juggling routine IT tasks within an already strained budget? We help organizations like yours handle daily technology duties and plan for extraordinary events without sapping resources from your mission.
Crisis Prevention Experts
When you need helpdesk support for daily operations, like password resets and hardware troubleshooting, managed IT services provide a scalable, flexible approach to talent to help your team members get to work quickly.
The Right Talent at the Right Time
When you need helpdesk support for daily operations, like password resets and hardware troubleshooting, outsourced IT services provide a scalable, flexible approach to talent to help your team members get to work quickly.
A Single Point of Contact
Because we manage all of your vendor relationships, issues with Internet slowness/outages, printers, phones, cell phones, websites are dealt with directly with the vendor by us. No more complicated vendor phone tag, one call; immediate results.
Find out how partnering with Proper Sky for Outsourced IT Services for your Fort Washington business can help you today!
Security is the de facto way hackers break into your personal life. In this webinar, we review with real examples just what can happen if your email is compromised, what practical steps you can take to spot risks and how you can quickly improve your email security posture."
https://propersky.com/areas-we-serve/fort-washington-pa-wireless-network-installation-support-consulting/,"A wireless network is an essential part of a business. The accessibility to information and mobility benefits it provides are crucial, keeping your business one step ahead in today’s competitive environment.
By utilizing a successful wireless network solution, a company can increase its revenue, improve employee productivity, enhance network security, and access business intelligence much easier.
Proper Sky provides wireless network installation, wireless network support and wireless network consulting in Fort Washington, PA. Our expert wireless network consultants can help you implement a powerful, robust wireless network into your business so you never have to deal with spotty coverage, slow speeds or outages again.
Whether it is an indoor or outdoor wireless network you require, we can deliver. Our service model follows a four-step approach and 100% coverage guaranteed system to ensure your wireless network installation expectations.
Survey
Our service starts with a site survey. We gain an overview of the wireless environment of your network, plan your objectives and outline the system you require.
Design
The wireless network we design factors in scalability for future growth including coverage, capacity, security, and redundancy.
Implementation
Our experienced wireless network installers will work with you to install your network with little or no disruption to your business and show you how to maintain it.
Post installation
Post the implementation phase we will perform a final wireless site survey. This ensures we have provided the coverage and capacity you require.
Why Proper Sky?
When it comes to wireless networks, we have what you need.
Whether you need a new wireless infrastructure or just needed a wireless installation service, we can provide it. We are also a partner and distributor to world-class wireless network device providers: Cisco Meraki, Ruckus, Aruba, and Ubiquiti.
You don’t have to build it all yourself. Do what you do best, and leave the rest to us. Our wireless installation service makes use of best practices- rest assured you receive the best output, in line with the standards you need.
Security is the de facto way hackers break into your personal life. In this webinar, we review with real examples just what can happen if your email is compromised, what practical steps you can take to spot risks and how you can quickly improve your email security posture."
https://propersky.com/areas-we-serve/horsham-pa-cloud-services-support-consulting/,"What’s better than blue sky thinking? Cloud thinking.
Without a doubt, the future of tech revolves around cloud-based software — and there’s never been a better opportunity to take advantage of it than right now. We’re finally seeing the long-term advantages of huge enterprise cloud solutions trickling down to the small-to-mid-market companies. We provide cloud computing support and consulting services in Horsham, PA. Our cloud consultants will help you identify the right solutions and help you integrate them into your business.
While benefits of the cloud are ultimately dependent on your business, team size, and your mission, leveraging cloud services yields several benefits that are too good to ignore:
Email hosting via the cloud
If you’re still hosting your own email server, we should talk. With Google Suite and Office 365, you’ll have access to secure tools that are always on and always available at a fraction of the cost of self-hosting.
Say goodbye to traditional telco circuits
Does your organization have a complicated setup of MPLS networks, hybrid VPN deployments or expensive, antiquated telco circuits? With cloud services, we can help you cut costs and streamline your setup.
Hosted desktop and server solutions
Cloud workspaces deliver the right data, at the right time, to the right people. Working from the cloud puts you at the digital helm of your organization, with complete control over access, rights, privileges, and more.
No data loss. Ever.
Hosting via the cloud means there’s a secure, real-time backup of your data all the time. It’s an end-to-end encrypted, 100% available enterprise solution accessible at a fraction of the cost when compared to competing models.
The way you work, at scale
Getting traction on just a single tweet could overwhelm your ecommerce system; the cloud presents ways for you to scale your business — in real time — when you need it, and back down when you don’t, so your system remains stable through traffic bursts.
We take a holistic approach to understanding your technology systems, ensuring you have the access and understanding you need in order to benefit from cloud services. We’ll build a cost-effective, tailored solution designed to improve reliability, drive down costs, and provide the necessary security for your organization — all while enabling you with the freedom to access it anywhere, any time.
Security is the de facto way hackers break into your personal life. In this webinar, we review with real examples just what can happen if your email is compromised, what practical steps you can take to spot risks and how you can quickly improve your email security posture."
https://propersky.com/areas-we-serve/horsham-pa-ehr-emr-support-consulting/,"From inception to go-live, Proper Sky has your EMR covered – you focus on patients
If your organization is evaluating an EMR or an EHR, you’re likely making the largest and most complicated technology commitment your organization will face. While EMR and EHR vendors promise everything, the delivery typically leaves much to be desired. Fortunately, fixing complicated, technical, and overwhelming issues is our specialty.
We provide comprehensive EHR and EMR support and consulting services in Horsham, PA. Our expert EHR and EMR consultants can help you select the best solution for your practice or if you already have an EHR/EMR package, we can help you get the most out of it.
By taking a simple approach that works with your enterprise’s needs, we review:
Helping you understand your technology investment
Before making a purchase, you have to consider several factors to ensure it’s worth your while. Though the questions you’ll ask yourself may seem simple, they quickly pile on. We’ll guide you every step of the way, before and after committing to an EHR.
Documenting essential information and training staff
EHR manuals often lack the practical information your staff needs in order to operate an EHR in a day-to-day environment. We specialize in training our clients’ teams to use a new EHR, so you can be confident your staff is using the technology correctly.
Determine your true data costs
When moving to a new EMR, you hope all of your data will be transferred. Sadly, this isn’t always the case. We can help you get the best amount of workable data possible from your legacy systems to your new systems, saving you time, money, and stress.
Turn data into insight
Analytics are crucial to business decisions, but EMR systems rarely come with the tools you need in order to understand your data. We’ll work with you to bring value to your data and give you the resources you need to make it meaningful.
By aligning the organizational goals of your enterprise, we can build a customized cybersecurity strategy that balances the latest threat intelligence and leading security practices with the factors that impact your at-risk information.
Security is the de facto way hackers break into your personal life. In this webinar, we review with real examples just what can happen if your email is compromised, what practical steps you can take to spot risks and how you can quickly improve your email security posture."
https://propersky.com/areas-we-serve/horsham-pa-it-strategy-planning/,"We believe in creating a tailored IT strategy completely aligned with your organization’s goals
Every business is unique; even in crowded local industries, internal processes for one company can be vastly different than those of another. You wouldn’t have the same sales strategy as your competitor — so why would you have a similar IT strategy? We help companies of all sizes in Horsham, PA with their IT planning and IT strategy.
Building an IT strategy that leverages your organization’s strengths and minimizes any weaknesses takes time and thorough consideration. We carefully factor those aspects into an IT strategy designed for your business.
Here’s what to expect when planning your IT strategy with Proper Sky:
Seek to Understand
Before planning a tailored IT strategy for your company, we gain a firm understanding of the internal workings of your organization. We develop strategies by identifying what makes your company unique, understanding how it functions, and clarifying your goals.
Meticulous strategic planning
We consider your company’s distinct functions, like team size and budget, so our recommendations don’t just work — but work for you. We lay comprehensive groundwork, ensuring your strategy maximizes your success..
Precision Execution
With a plan in place, it’s time to execute. We’ll work with you to implement your unique strategy, taking extra care to ensure it delivers the best results.
Measuring success in a practical way
Our partnership doesn’t end with implementation. We constantly measure our work’s impact, using data to determine the strategy’s success and identifying how we can improve it along the way.
All too often we see organizations view IT as a cost driver and not as an opportunity to increase their bottom line. Let us help you navigate the turbulent world of technology with a plan that fits around YOUR strategic objectives. You need a team with a demonstrated history of strategic success. You need Proper Sky.
Security is the de facto way hackers break into your personal life. In this webinar, we review with real examples just what can happen if your email is compromised, what practical steps you can take to spot risks and how you can quickly improve your email security posture."
https://propersky.com/areas-we-serve/horsham-pa-managed-it-support-services/,"Your team values efficiency, security, and innovation. By taking a proactive approach to information technology, you’ll know your team won’t be overburdened, and you’ll reduce unnecessary bottlenecks that prevent progress.
We provide professional managed IT support services in Horsham, PA:
Managed your business - We'll take care of the technical domain
Ready to stop juggling routine IT tasks within an already strained budget? We help organizations like yours handle daily technology duties and plan for extraordinary events without sapping resources from your mission.
Crisis Prevention Experts
When you need helpdesk support for daily operations, like password resets and hardware troubleshooting, managed IT services provide a scalable, flexible approach to talent to help your team members get to work quickly.
The Right Talent at the Right Time
When you need helpdesk support for daily operations, like password resets and hardware troubleshooting, managed IT services provide a scalable, flexible approach to talent to help your team members get to work quickly.
A Single Point of Contact
Because we manage all of your vendor relationships, issues with Internet slowness/outages, printers, phones, cell phones, websites are dealt with directly with the vendor by us. No more complicated vendor phone tag, one call; immediate results.
Find out how partnering with Proper Sky for Managed Services for your Horsham business can help you today!
Security is the de facto way hackers break into your personal life. In this webinar, we review with real examples just what can happen if your email is compromised, what practical steps you can take to spot risks and how you can quickly improve your email security posture."
